id,title,description,link,image_link,price,availability,condition,brand,google_product_category,identifier_exists
PV001,Real Estate Lead Generation,AI prompts for listing descriptions, cold outreach, and follow-ups to attract qualified leads in minutes. Used by Real Estate pros. From $9. PromptVault USA.,https://promptvaultusa.com/vault/pv001,https://promptvaultusa.com/images/niche_001.jpg,15.00,in stock,new,PromptVault USA,5827,no
PV002,Freelancer Client Acquisition,Prompts for proposals, outreach messages, and negotiation scripts for freelancers. Get clients in minutes. Used by Business pros. From $9. PromptVault USA.,https://promptvaultusa.com/vault/pv002,https://promptvaultusa.com/images/niche_002.jpg,15.00,in stock,new,PromptVault USA,5827,no
PV003,TikTok Affiliate Marketing,Viral hooks, captions, and scripts for promoting affiliate products on TikTok. Get engagement in minutes. Used by Marketing pros. From $9. PromptVault USA.,https://promptvaultusa.com/vault/pv003,https://promptvaultusa.com/images/niche_003.jpg,15.00,in stock,new,PromptVault USA,5827,no
PV004,YouTube Automation,Scripts, video ideas, and content planning prompts for faceless YouTube channels. Get automated content in minutes. Used by Video pros. From $9. PromptVault USA.,https://promptvaultusa.com/vault/pv004,https://promptvaultusa.com/images/niche_004.jpg,15.00,in stock,new,PromptVault USA,5827,no
PV005,E-commerce Product Descriptions,High-converting product descriptions for Shopify, Amazon, and dropshipping. Get sales in minutes. Used by E-commerce pros. From $9. PromptVault USA.,https://promptvaultusa.com/vault/pv005,https://promptvaultusa.com/images/niche_005.jpg,15.00,in stock,new,PromptVault USA,5827,no
PV006,Copywriting Sales Pages,Prompts to create persuasive landing pages and sales funnels that convert. Get copy in minutes. Used by Copywriting pros. From $9. PromptVault USA.,https://promptvaultusa.com/vault/pv006,https://promptvaultusa.com/images/niche_006.jpg,15.00,in stock,new,PromptVault USA,5827,no
PV007,Email Marketing Campaigns,Email sequences for promotions, newsletters, and high-level customer retention. Get engagement in minutes. Used by Marketing pros. From $9. PromptVault USA.,https://promptvaultusa.com/vault/pv007,https://promptvaultusa.com/images/niche_007.jpg,15.00,in stock,new,PromptVault USA,5827,no
PV008,Instagram Growth,Captions, reels ideas, and engagement strategies for scaling Instagram presence. Get engagement in minutes. Used by Marketing pros. From $9. PromptVault USA.,https://promptvaultusa.com/vault/pv008,https://promptvaultusa.com/images/niche_008.jpg,15.00,in stock,new,PromptVault USA,5827,no
PV009,Facebook Ads Copy,High-converting ad copy frameworks for Facebook and Meta campaigns. Get high conversions in minutes. Used by Ads pros. From $9. PromptVault USA.,https://promptvaultusa.com/vault/pv009,https://promptvaultusa.com/images/niche_009.jpg,15.00,in stock,new,PromptVault USA,5827,no
PV010,Personal Branding,Content ideas and storytelling prompts to build authority online in 2026. Get new clients in minutes. Used by Business pros. From $9. PromptVault USA.,https://promptvaultusa.com/vault/pv010,https://promptvaultusa.com/images/niche_010.jpg,15.00,in stock,new,PromptVault USA,5827,no
PV011,Resume & Job Applications,Resume writing, cover letters, and interview preparation prompts for top-tier jobs. Get opportunities in minutes. Used by Career pros. From $9. PromptVault USA.,https://promptvaultusa.com/vault/pv011,https://promptvaultusa.com/images/niche_011.jpg,15.00,in stock,new,PromptVault USA,5827,no
PV012,Startup Pitch Decks,Prompts to create investor-ready presentations and business pitches for startups. Get clients in minutes. Used by Business pros. From $9. PromptVault USA.,https://promptvaultusa.com/vault/pv012,https://promptvaultusa.com/images/niche_012.jpg,15.00,in stock,new,PromptVault USA,5827,no
PV013,Blog Content Creation,SEO blog outlines, articles, and long-form keyword strategies for content. Get SEO-optimized content in minutes. Used by Writing pros. From $9. PromptVault USA.,https://promptvaultusa.com/vault/pv013,https://promptvaultusa.com/images/niche_013.jpg,15.00,in stock,new,PromptVault USA,5827,no
PV014,SEO Optimization,Prompts for keyword research, meta descriptions, and ranking strategies for Google. Get top rankings in minutes. Used by SEO pros. From $9. PromptVault USA.,https://promptvaultusa.com/vault/pv014,https://promptvaultusa.com/images/niche_014.jpg,15.00,in stock,new,PromptVault USA,5827,no
PV015,Podcast Scripts,Episode outlines, intros, and storytelling frameworks for professional podcasts. Get engaging episodes in minutes. Used by Audio pros. From $9. PromptVault USA.,https://promptvaultusa.com/vault/pv015,https://promptvaultusa.com/images/niche_015.jpg,15.00,in stock,new,PromptVault USA,5827,no
PV016,Online Course Creation,Prompts for structuring, curriculum mapping, and launching digital courses. Get successful courses in minutes. Used by Education pros. From $9. PromptVault USA.,https://promptvaultusa.com/vault/pv016,https://promptvaultusa.com/images/niche_016.jpg,15.00,in stock,new,PromptVault USA,5827,no
PV017,Digital Product Sales,Ideas and marketing prompts for ebooks, templates, and digital guides. Get high-converting sales in minutes. Used by E-commerce pros. From $9. PromptVault USA.,https://promptvaultusa.com/vault/pv017,https://promptvaultusa.com/images/niche_017.jpg,15.00,in stock,new,PromptVault USA,5827,no
PV018,AI Art Generation,Creative prompts for generating unique AI artwork across multiple models. Get unique art in minutes. Used by Creative pros. From $9. PromptVault USA.,https://promptvaultusa.com/vault/pv018,https://promptvaultusa.com/images/niche_018.jpg,15.00,in stock,new,PromptVault USA,5827,no
PV019,Midjourney Prompt Pack,Highly detailed prompts for creating stunning AI images using Midjourney v7. Get unique art in minutes. Used by Creative pros. From $9. PromptVault USA.,https://promptvaultusa.com/vault/pv019,https://promptvaultusa.com/images/niche_019.jpg,15.00,in stock,new,PromptVault USA,5827,no
PV020,Chatbot Scripts,Prompts for building conversational AI flows and complex customer responses. Get automation in minutes. Used by Tech pros. From $9. PromptVault USA.,https://promptvaultusa.com/vault/pv020,https://promptvaultusa.com/images/niche_020.jpg,15.00,in stock,new,PromptVault USA,5827,no
PV021,Customer Support Replies,Templates for professional and lightning-fast customer service responses. Get new clients in minutes. Used by Business pros. From $9. PromptVault USA.,https://promptvaultusa.com/vault/pv021,https://promptvaultusa.com/images/niche_021.jpg,15.00,in stock,new,PromptVault USA,5827,no
PV022,Cold Email Outreach,Effective and psychological cold email scripts for massive lead generation. Get massive leads in minutes. Used by Sales pros. From $9. PromptVault USA.,https://promptvaultusa.com/vault/pv022,https://promptvaultusa.com/images/niche_022.jpg,15.00,in stock,new,PromptVault USA,5827,no
PV023,LinkedIn Networking,Connection messages and authority-building personal branding prompts for LinkedIn. Get top opportunities in minutes. Used by Career pros. From $9. PromptVault USA.,https://promptvaultusa.com/vault/pv023,https://promptvaultusa.com/images/niche_023.jpg,15.00,in stock,new,PromptVault USA,5827,no
